87120;'Rick';'Mon Sep 24, 2012 4:53 pm';'Tonight, 8pm, might be worth a look...?\n\n\n\nRJ'
87131;'pigtin';'Mon Sep 24, 2012 8:29 pm';"""Oh dear! Just switched off... a couple of geezers on an ego trip, couldn't take any more when they picked up the shock absorber in the breakers yard. Would you want to sell a classic at a knockdown price to this guy?"""
87133;'riley541';'Mon Sep 24, 2012 8:47 pm';"""What a terrible programme. Why on earth did the production company choose that foul mouthed cockney bodger to front it? I'll watch this one until the bitter end out of curiousity but that's it for me, no more of this rubbish."""
87135;'47p2';'Mon Sep 24, 2012 9:00 pm';"""I've recorded it to watch later, I might give it a miss now"""
87136;'Rick';'Mon Sep 24, 2012 9:04 pm';"'Deary me, ""restore"" something and leave that awful glass pop-up sunroof in it, not to mention the junk they bought from the other fella. Good to hear that they repaired a piston, and cleaned out the cylinders though ... \n\n\n\n\xc2\xa330k?\n\n\n\nRJ\n\n\n\nI\'ll probably watch the next one though, out of curiosity'"
87139;'welshrover';'Mon Sep 24, 2012 9:09 pm';'what a load of rubbish .arthur daley would have done a better job . poxy modern sunroof ,nice pinky red paint then bangs it into an engine .would you buy a car from these two plonkers .'
87140;'welshrover';'Mon Sep 24, 2012 9:10 pm';"""47p2 wrote:\t\t\t  I've recorded it to watch later, I might give it a miss now  \t\n\ni wouldn't bother."""
87142;'swampy';'Mon Sep 24, 2012 10:02 pm';"""One and half days to sort out the 'too much oil in the carb' issue just after he had boasted that he'd been doing this for thirty something years   I can truly say that I was awestruck"""
87146;'welshrover';'Mon Sep 24, 2012 10:31 pm';'those diagprahms in the carbs looked new too.'
87148;'Penman';'Tue Sep 25, 2012 12:34 am';"""Hi\n\nThe e type was the first car designed using a wind tunnel??\n\nI think not, Bristol Cars used Bristol Aeroplane's wind tunnel in the design stages of the 401 introduced in 1948."""
87149;'victor 101';'Tue Sep 25, 2012 1:34 am';'I turned off before it was half way through, about where he pulled some supposedly E type parts of the back of a pick up truck.'
87151;'peterwpg';'Tue Sep 25, 2012 4:28 am';"'Penman wrote:\t\t\t  Hi\n\nThe e type was the first car designed using a wind tunnel??\n\nI think not, Bristol Cars used Bristol Aeroplane\'s wind tunnel in the design stages of the 401 introduced in 1948.\t\n\n\n\nand as far back as 1934 Chrysler used the wind tunnel for their ""Airflow"" series.   \n\n\n\nI haven\'t seen the programme that is the subject of this thread, but poorly researched and gross presentations are quite common this side of the ""pond""'"
87154;'pigtin';'Tue Sep 25, 2012 6:41 am';"""It was dumbed down to a point where I thought I'd switched on Eastenders by mistake. I believe there are a load of 'Toff' producers with a very strange idea about what many of us 'Plebs' like to watch. Surely they could have asked someone who knew about restorations to look it over.\n\nHaving switched off before halfway through I can only assume, from comments on here, the programme didn't redeem itself in the second half..."""
87156;'riley541';'Tue Sep 25, 2012 7:21 am';'Make your opinion known - I have-\n\n\n\ncustomerservices@channel5.com'
87157;'Rick';'Tue Sep 25, 2012 7:41 am';'Times like this I wish I had shares in Isopon \n\n\n\nRJ'
87158;'pigtin';'Tue Sep 25, 2012 7:45 am';"""Rick wrote:\t\t\t  Times like this I wish I had shares in Isopon \n\n\n\nRJ\t\n\n\n\nThe guy had a very fancy magnet, perhaps we should all get one... it's probably what the trade use."""
87162;'baconsdozen';'Tue Sep 25, 2012 9:38 am';"""I switched off part way,it was total twaddle.\n\nI'm not sure I heard it right but I'm sure they said Jaguar invented IRS as drivers were finding it difficult to handle the car as it was so long?.\n\nThe restoration was a bodge and looked like it was done in twenty one days.\n\nI agree,it was like an episode of Eastenders,a poor one even by their standards."""
87164;'Rick';'Tue Sep 25, 2012 9:48 am';"""Programmes like this emphasise how important it is to keep a close eye on any restorer entrusted with one's pride-and-joy. I imagine pukka restoration companies cringed when they saw this.\n\n\n\nAlthough the valuation seemed a little optimistic, I'm glad the fella from RM at least pointed out the hideous sunroof, change of colour, and it being auto and LHD as being some of the car's less attractive points.\n\n\n\nRJ"""
87167;'MikeEdwards';'Tue Sep 25, 2012 10:24 am';'I completely forgot to set the box to record this, but from here and another thread it sounds as if I had a lucky escape.'
87169;'riley541';'Tue Sep 25, 2012 11:23 am';"""Rick wrote:\t\t\t  \n\nAlthough the valuation seemed a little optimistic, I'm glad the fella from RM at least pointed out the hideous sunroof, change of colour, and it being auto and LHD as being some of the car's less attractive points.\n\nRJ\t\n\nYet he still valued it at \xc2\xa330,000!"""
87170;'Rick';'Tue Sep 25, 2012 11:31 am';"""riley541 wrote:\t\t\t   \t  Rick wrote:\t\t\t  \n\nAlthough the valuation seemed a little optimistic, I'm glad the fella from RM at least pointed out the hideous sunroof, change of colour, and it being auto and LHD as being some of the car's less attractive points.\n\nRJ\t\n\nYet he still valued it at \xc2\xa330,000!\t\n\n\n\nAnd would anyone looking for a 2+2 really consider this one, assuming they had a clue about old cars? Perhaps if it came at the right price, and a prospective purchaser wanted to fit one with a period-correct Webasto roof, but otherwise ...?\n\n\n\nR"""
87171;'smiffy220';'Tue Sep 25, 2012 12:54 pm';"""I'm hearing the whole thing was a set up anyway, nothing was real about this programme apparently. Even the breakers yard was fake and a mate of his with staged parts in.\n\n\n\nI haven't watched it, don't think I'll bother either."""
87176;'gillberry';'Tue Sep 25, 2012 5:11 pm';'Same here thought we would give it a look but WHY does everything have to be so staged do they think we are that thick that we will not notice!'
87199;'smiffy220';'Wed Sep 26, 2012 12:55 pm';"""I tried to watch 10 mins of it last night. What a load of rubbish. Staged parts, an ego trip for the so called presenter, and some terrible over acting when they started the thing up and it smoked.\n\nI've taken that of my future planner on sky!!"""
87211;'baconsdozen';'Wed Sep 26, 2012 7:25 pm';'I wonder why when there are so many people the shows organisers could have consulted,that they ended up with a couple who make Arthur Dailey look like mechanic of the year.\n\nDid they really believe anyone with the faintest interest in classic cars would find the program at all informative?.Maybe it was supposed to be a comedy.'
87225;'riley541';'Thu Sep 27, 2012 7:52 am';"""Probably produced by Bernie's Broadcasting Company, I can't think anyone else would cast him. \n\nBTW - it's repeated this evening."""
87233;'Doz';'Thu Sep 27, 2012 11:13 am';"""riley541 wrote:\t\t\t  BTW - it's repeated this evening.\t\n\nExcellent - I can miss it twice!"""
87236;'peterwpg';'Thu Sep 27, 2012 3:01 pm';"""I guess that anyone who was associated with the Kray's  can't be all bad.   \n\n\n\ncan they ?"""
87238;'riley541';'Thu Sep 27, 2012 3:50 pm';"""Doz wrote:\t\t\t   \t  riley541 wrote:\t\t\t  BTW - it's repeated this evening.\t\n\nExcellent - I can miss it twice!  \t\n\n\n\nFortunately it clashes with the Goodwood Revival on ITV4"""
87247;'norustplease';'Thu Sep 27, 2012 8:13 pm';"""Well, I couldn't resist it. After everyone's comments I had to go on line and watch it. It was so awful that I may watch the next one for a laugh.  My opinion of Adrian Flux as  sponsor has slipped, however. Would you as part of a serious car restoration industry want to be associated with this sort of thing?\n\nI wondered why they wasted the first part of the programme with the odious Bernie insulting people on the phone and making rude comments about their cars and asking prices.The car 'as found' looked as if it had been decorated to appear rougher than it was, and the whole thing was vaguely reminiscent of the extremely stagey  'Pimp my Ride' series. No attempt to talk about what sort of state the underbody might be in and no attempt to derust the inside of the shell. The episode with the carbs, totally spurious. \n\nAnd as for the guy walloping the nosecone with a hammer.....pass the filler!\n\n\n\nAnd then the valuer doesn't even bend down and look underneath...sorry, I prefered scrapheap challenge."""
116287;'MikeEdwards';'Thu Apr 24, 2014 11:02 am';"'It\'s just another so-called entertainment programme designed to appeal to the kind of people that enjoy the drama without worrying too much about the accuracy. I\'d imagine it\'s aimed at the same people that watch ""Storage Hunters"" or is it ""Ultimate Makeover"" where they knock someones house down and rebuild it. I would imagine anyone who has some actual knowledge of any of the subjects covered by these things will be similarly outraged - property developers, antiques dealers, specialist transport companies.\n\n\n\nThey\'re OK for what they are, there\'s always a cliff-hanger for the ad breaks to give the viewer time to get another can of cheap lager and get rid of the remnants of the last one. Something has to fill the schedules now we\'ve got so many TV channels.'"
116351;'Richard H';'Fri Apr 25, 2014 4:46 pm';"""I watched the MGB episode, that was enough for me I'm afraid! However, I do enjoy watching Wheeler Dealers when they tackle classics, and that new one with Fuzz Townsend from Practical Classics in it."""
116463;'gresham flyer';'Tue Apr 29, 2014 1:31 am';'I could not stand looking at a TV trailer for Classic Car Rescue....utter piffle.\n\n\n\nGive the yanks their  do...they make some good shows with some laughs along the way, but quality vehicles at the end.\n\n\n\nHave you ever seen a bummer vehicle on Overhaulin.?\n\n\n\n                            G.f'
117636;'vitesse';'Mon Jun 02, 2014 11:59 pm';"'I noticed on the program tonight that they put a disclaimer at the start. ""This program contains rows, rust and wrecks. The garage team are mechanical experts and the car rescued is genuine, although some of what you\'ll see has been engineered for entertainment.""\n\n\n\nWell at least the producers have been listening to people who have clearly complained. I would like to differ with the usage of the word expert though. But hey I still watched it.'"
117910;'Rick';'Mon Jun 09, 2014 10:04 pm';"""Well that's another series put to bed mercifully, I had to put it on mute for a while during one outburst in the 'shop during this evening's Corvette build. I don't know why I watched it really, possibly it was in the hope that maybe one episode would be a good use of 60 minutes.\n\n\n\nRJ"""
117986;'vitesse';'Wed Jun 11, 2014 7:40 pm';'I must admit I was the same Rick. Not a huge fan of American cars but I had it on I spent the majority of the time browsing OCC Forum on my tablet. The only time I looked up was when they blew the exhaust box up and wrecked the bodywork. Thinking is that another staged stunt or are they really that stupid?\n\n\n\nTony'
117994;'V8 Nutter';'Wed Jun 11, 2014 9:42 pm';"""I couldn't believe they didn't buy the first Corvette, then they spent a lot more money on a less desirable car in much worse condition. They didn't even realise the engine had been modified."""
87253;'D4B';'Fri Sep 28, 2012 8:20 am';'Watched it last night ~ twas awful.... \n\n\n\nBernie should have stuck to Banglar Bangers'
87254;'ukdave2002';'Fri Sep 28, 2012 8:35 am';"'norustplease wrote:\t\t\t  Well, I couldn\'t resist it. After everyone\'s comments I had to go on line and watch it..\t\n\n\n\nI thought exactly the same, so watched on line   it was dire, the director clearly unsure who his intended audience was.\n\n\n\nWhat was annoying is that they really didn\'t show any restoration, the engine work was glossed over with the statement that ""a piston was fixed"" , the body was taken back to bare metal (not a normal bodgers technique) but we didn\'t see  how they tackled any of the body faults that must have been present in a 50 year old car   ok there was some tapping down of ""high\'s"" on the bonnet; staged for the camera, and we saw the filler applied, but was it an inch thick or just a few thou?. I suspect it was the latter as the body blokes turned out what (on the TV) looked pretty good; nice paint equal panel gaps, but the implication was that the body was ""full of filler""\n\n\n\nWhy they made a program that went out of its way to seem to promote bodging; not spent 5 quid on some metal and an hours labour on getting rid of the sunroof, why imply they were fitting secondhand, brake discs, exhaust components and shock\'s, why stage the phoney crash and make a big deal of surplus oil in the carbs, when they could have at least explained the original misfire...\n\n\n\nI think it should have been called ""Carry on Restoration"" then at least we could have laughed at it!\n\n\n\nDave'"
87255;'MikeEdwards';'Fri Sep 28, 2012 10:38 am';"'I watched it last night, on a ""so bad it\'s good"" basis. Yes, the ""fixed a worn piston"" bit was interesting, just mentioned in passing, in fact I wonder if it was a brake piston and they just didn\'t mention that to make it sound more complicated. I also thought it might be a bit hard to have painted the inside of the bonnet red without removing either it or the engine, but I don\'t know E-types that well. I guess there\'s a chance the PO had done that, as it looked like he had started painting red around it.\n\n\n\nWould you use an angle grinder with a grinding disc to remove paint on an E-type? I wouldn\'t. No wonder they roughed the surface of the metal up so much.\n\n\n\nThe crash bit was pathetic. An otherwise empty section of garage, strangely-voiced bloke (Alfa Romero? What\'s an Alfa Romero?) backs slowly into an engine that has no business being there, and it sticks a big dent in the lower quarter panel? No chance. Hard to see why it was much more than a small scrape in real life.\n\n\n\nI have trouble believing that second-hand brake disc was going anywhere near the E-type, and I was quite surprised we got as far as the first ad break and they still hadn\'t bought the car. Would even have been better if they\'d stop assuming we have the memories of a goldfish and keep re-showing bits of the program we only watched ten minutes ago![/b]'"
87257;'Inglewood';'Fri Sep 28, 2012 10:59 am';'I agree with all that has been said, really unsatisfying programme.\n\n\n\nI noted the car started off with California style bonnet mounted lights that had disappeared in the finished views. \n\n\n\nNo mention if the vehicle had been through a SVA following re-import.\n\n\n\nThe valuer did not appear to peruse any documents prior to putting a value on it. What was the value? Retail, Auction?? \n\n\n\n4 weeks, 7 mechanics, Tweedle Dee & Tweedle Dum and they only made \xc2\xa310,000, not much of a business plan?\n\n\n\nBest get it back to California before it rusts and the P38 falls off like fish scales.'
87259;'ukdave2002';'Fri Sep 28, 2012 11:42 am';"""Inglewood wrote:\t\t\t  \n\n4 weeks, 7 mechanics, Tweedle Dee & Tweedle Dum and they only made \xc2\xa310,000, not much of a business plan?.\t\n\n\n\nI think its worse than that; Cost of mechanics can't be any less than \xc2\xa3200 per day, I think there were 4  of them?  for 4 weeks= \xc2\xa3200*4*20(days)= \xc2\xa316,000. Cost of car \xc2\xa312,000, leaving \xc2\xa32k for all the parts, trim, paint, overheads etc...... I have assumed the 2 clowns were free  \n\n\n\nDave"""
87273;'47Jag';'Fri Sep 28, 2012 7:21 pm';"'When this thread started I thought the car in question was a Citroen C5    and I thought to myself ""that\'s not much of a classic"". Then I saw it was on last night and everything fell into place. Truly awful!! I don\'t think a \'properly\' restored American spec. E-type 2+2 would fetch \xc2\xa330K. You do all realise that you could win this car?\n\n\n\nArt'"
87274;'gresham flyer';'Fri Sep 28, 2012 7:35 pm';'They should have featured the car I have just worked on...A Rover P5B Coupe.\n\nIt had been off the road for many years.\n\nIt ran but the brakes were siezed and the bodywork corroded in all the P5`s vunerable area`s.\n\nI had it in the workshop for 15 day`s, I carried out the work and was assisted for 5 day`s by a mechanic friend .\n\nWork carried out ...\n\nNew inner,middle and outer sills+ jacking points.\n\nNew a posts.\n\nFront wings removed and inner wings repaired.\n\nNew front wing bottom repair sections fitted.\n\nNew D post`s inner and outer +associated metalwork repairs.\n\nRear boot repairs to wheelarches and battery box area.\n\nNew battery box.\n\nNew rear valance and local repairs.\n\nRear doors repaired.\n\nArea`s next to front windscreen repaired.\n\nOther frabrication repairs as required.\n\nThe bodyshell is now as solid as a rock.\n\n\n\nMy mechanic friend serviced the engine,gearbox,rear axle and changed all fluids.\n\nThe braking system was completly renewed.\n\nBottom ball joints replced (not a straight forward fix).\n\n\n\nI took it for it`s mot today and it passed first time.\n\n\n\nWe carried out the work without any drama or theatrical scenes.\n\n\n\nAnother Rover P5B saved from the banger boy`s.\n\n\n\n                                  Gresham Flyer'
87275;'ukdave2002';'Fri Sep 28, 2012 7:54 pm';"'gresham flyer wrote:\t\t\t  They should have featured the car I have just worked on...A Rover P5B Coupe.\t\n\n\n\nYes but can you:\n\n\n\nFind a mate with a lorry load of spares that he will sell for \xc2\xa35\n\n\n\nHave a rouge engine lying around  that will be invisible until you hit it.\n\n\n\nRefurbish an engine for the cost of ""repairing a piston""\n\n\n\nPut a new sunroof in the P5 \n\n\n\nSpray the car in a different colour\n\n\n\nSpend 2 days looking at an exhaust for excess of carb damper oil\n\n\n\nOtherwise it just wont interest us :              \n\n\n\nDave'"
87342;'Rick';'Mon Oct 01, 2012 10:16 am';"'A 911 gets ""the treatment"" tonight, no doubt the E-Type ""resto"" was just a blip, and the Porker will receive an accurately-described, top-notch job. \n\n\n\nThen again..   \n\n\n\nR'"
87367;'Roger-hatchy';'Mon Oct 01, 2012 2:40 pm';'Well they might have some spares left over from the last *&^%$\xc2\xa3 bodgit and scarper comedy.'
87375;'Rick';'Mon Oct 01, 2012 3:12 pm';"'Roger-hatchy wrote:\t\t\t  Well they might have some spares left over from the last *&^%$\xc2\xa3 bodgit and scarper comedy.\t\n\n\n\nNo doubt they\'ll find a useable clutch assembly in a nearby lake that they can use, a set of tyres off an abandoned milk float, or perhaps some good s/h headlamp bulbs from a rusty Beetle that can be fixed up and used ""no bovva mate"".\n\n\n\nR'"
87377;'pigtin';'Mon Oct 01, 2012 3:27 pm';"""It's begining to sound like 'Scrapheap Challenge.'"""
87378;'Doz';'Mon Oct 01, 2012 3:47 pm';"'Rick wrote:\t\t\t  No doubt they\'ll find a useable clutch assembly in a nearby lake that they can use, a set of tyres off an abandoned milk float, or perhaps some good s/h headlamp bulbs from a rusty Beetle that can be fixed up and used ""no bovva mate"".\t\n\nWhat, you\'ve already seen it...?'"
87383;'Rick';'Mon Oct 01, 2012 4:31 pm';"'Doz wrote:\t\t\t   \t  Rick wrote:\t\t\t  No doubt they\'ll find a useable clutch assembly in a nearby lake that they can use, a set of tyres off an abandoned milk float, or perhaps some good s/h headlamp bulbs from a rusty Beetle that can be fixed up and used ""no bovva mate"".\t\n\nWhat, you\'ve already seen it...?  \t\n\n\n\nI\'m in it .... NOT REALLY! \n\n\n\nR'"
87384;'victor 101';'Mon Oct 01, 2012 5:42 pm';"""I started to watch it last week, but, like everyone here I thought it was rubbish, but I may watch it tonight for a different reason. Last week I thought I was going to watch a serious restoration program. This week I'm going to watch *spot the deliberate mistake* and see how many I can find."""
87755;'Churchill Johnson';'Tue Oct 09, 2012 10:12 pm';"'riley541 wrote:\t\t\t  Make your opinion known - I have-\n\n\n\ncustomerservices@channel5.com\t Not wishing to knock anyone who make\'s a comment on the rubbish that is shown on TV but when do the producer\'s take any notice, i myself have written several time\'s not e-m\'s but proper letter\'s to two different TV station\'s in the past and all i got was a reply to the effect that ""they were sorry i did not enjoy the programme and in the future they would take on board my complaint\'s\'\' of course they carried on as before, it\'s a captive audience, i am so happy that TV\'s are made with an on and off button.'"
87761;'riley541';'Wed Oct 10, 2012 7:51 am';"""Churchill Johnson wrote:\t\t\t   \t  riley541 wrote:\t\t\t  Make your opinion known - I have-\n\n\n\ncustomerservices@channel5.com\t Not wishing to knock anyone who make's a comment on the rubbish that is shown on TV but when do the producer's take any notice... \t\n\n\n\nIf only one or two complaints are received, they won't but if the number of complaints is in the thousands, they will.\n\n\n\nFrom what I've read in this forum and elsewhere, hundreds of people think the series is absolute rubbish yet they're all still watching it and writing about in forum threads rather than complaining to Channel 5 - who must be delighting in all the free publicity!"""
87768;'Journer';'Wed Oct 10, 2012 3:39 pm';'For such a **** programme it certainly gets a lot of attention. Personally, I cant stand the amatuer dramatics and the forced anger but to each his own. I prefer Mike Brewer and big Ed, in my opinion they can do no wrong...lol'
87780;'ukdave2002';'Thu Oct 11, 2012 7:21 am';"""riley541 wrote:\t\t\t   \t  Churchill Johnson wrote:\t\t\t   \t  riley541 wrote:\t\t\t  Make your opinion known - I have-\n\n\n\ncustomerservices@channel5.com\t Not wishing to knock anyone who make's a comment on the rubbish that is shown on TV but when do the producer's take any notice... \t\n\n\n\nIf only one or two complaints are received, they won't but if the number of complaints is in the thousands, they will.\n\n\n\nFrom what I've read in this forum and elsewhere, hundreds of people think the series is absolute rubbish yet they're all still watching it and writing about in forum threads rather than complaining to Channel 5 - who must be delighting in all the free publicity!\t\n\n\n\nViewing figures will be the only thing C5 will be interested in, as this directly dictates revenue from  advertisers  .  Making a  controversial  program that maintains the viewing numbers certainly wont bother them.\n\n\n\nDave"""
87781;'riley541';'Thu Oct 11, 2012 7:59 am';"""ukdave2002 wrote:\t\t\t   \t  riley541 wrote:\t\t\t   \t  Churchill Johnson wrote:\t\t\t   \t  riley541 wrote:\t\t\t  Make your opinion known - I have-\n\n\n\ncustomerservices@channel5.com\t Not wishing to knock anyone who make's a comment on the rubbish that is shown on TV but when do the producer's take any notice... \t\n\n\n\nIf only one or two complaints are received, they won't but if the number of complaints is in the thousands, they will.\n\n\n\nFrom what I've read in this forum and elsewhere, hundreds of people think the series is absolute rubbish yet they're all still watching it and writing about in forum threads rather than complaining to Channel 5 - who must be delighting in all the free publicity!\t\n\n\n\nViewing figures will be the only thing C5 will be interested in, as this directly dictates revenue from  advertisers  .  Making a  controversial  program that maintains the viewing numbers certainly wont bother them.\n\n\n\nDave\t\n\n\n\nWhich is why, having watched the first programme, I am not watching the rest. Unfortunately others seem to be continuing to watch it and boosting viewing figures."""
87824;'peterwpg';'Fri Oct 12, 2012 2:48 pm';"""For all those who are blocked from viewing Channel  5,  The Discovery Channel will be airing the series staring on Monday 15th November.\n\n\n\nFollowing up on Riley's comment,  I promise not to buy anything that is advertised during the show."""
87831;'D4B';'Fri Oct 12, 2012 4:52 pm';'I did stumble accross this again just as Bernie was spraying \n\nthe MG with the rag left on the roof ~ by the time he was in the \n\npub begging the painter to come back I switched over.....\n\n\n\nI promise never to stumble accross it again ~ simply dreadful'
