115938;'MikeEdwards';'Tue Apr 15, 2014 10:33 am';"'I saw bits of it - I was trying to clear some space off my recorder by watching stuff, so I was switching between this and ""No country for old men"", which is a reasonable film but a rubbish ending. \n\n\n\nThe usual rubbish - they go to see a car that\'s clearly a breaker, offer \xc2\xa31000 when the bloke is asking \xc2\xa32000, then have to go elsewhere to get a different one. Then come back later and give \xc2\xa3250 for just the front seats. Then in the ""history"" bits where they tell us all about the car, it\'s illustrated with loads of film clips ... of 968s and 944s along with 928s.'"
116194;'MikeEdwards';'Tue Apr 22, 2014 10:40 am';"""I hope you guys on here that are restoring Fiat 500s watched last night's programme and are now reflecting on whether you should re-do any of your work to match Mawio and teams efforts.   \n\n\n\n(I didn't watch the show, managed to resist it completely this week)."""
116195;'baconsdozen';'Tue Apr 22, 2014 11:18 am';"""I know filler heats up as it sets and judging by the amounts they use I wonder if we've now found the reason for global warming."""
116197;'colwyn500';'Tue Apr 22, 2014 12:16 pm';"""MikeEdwards wrote:\t\t\t  I hope you guys on here that are restoring Fiat 500s watched last night's programme and are now reflecting on whether you should re-do any of your work to match Mawio and teams efforts.   \n\n\n\n(I didn't watch the show, managed to resist it completely this week).\t\n\n\n\nComplete numpties.  It took a whole workshop of them to put the seat-sliders on the rails; I don't even think that was one of their fake items of jeopardy., they had just bent them with their extremely coarse handling.\n\nI suspect that their car could probably now do with a restoration.\n\n\n\nOn second thoughts, a bit harsh, it had a nice interior and someone is going to get a few years out of it before it starts playing up."""
116211;'lowdrag';'Wed Apr 23, 2014 7:00 am';"'I watched a bit of the Porsche one to see if it was as bad as the last series and shan\'t watch again. pure - but terrible - attempt at comedy. There was quite a scandal when the same chap put a few of the cars from the last series on Ebay I remember.\n\n\n\nOn a brighter note I came across a series called ""Restoration Garage"" on National Geographic and it is very interesting. I mean, they take more than two weeks to restore a car, they over-run on costs, their estimates for restoration are realistic as are their time schedules but they are very interesting people and are building a Bugatti Aerolithe from just photos - and in magnesium just like the original. I have recorded the series.'"
116234;'Greeney in France';'Wed Apr 23, 2014 1:50 pm';"""It was indeed appalling TV but what gets me the most is that the makers of such programs think that we would enjoy it   \n\nDo they really think we are stupid enough to believe their rows and trumped up problems, with the same format every week!\n\n2000 quid on a top end engine build and they don't put a new clutch in..\n\n\n\nIts a disgrace to call it classic car anything, let alone rescue."""
116237;'riley541';'Wed Apr 23, 2014 2:09 pm';"""Terrible or not, just about every car forum has a thread running about it  which guarantees additional viewers; either those who can't believe it'll be as bad a second time or those who can't believe it's as bad as others made it out to be."""
116238;'colwyn500';'Wed Apr 23, 2014 2:24 pm';"'riley541 wrote:\t\t\t  Terrible or not, just about every car forum has a thread running about it  which guarantees additional viewers; either those who can\'t believe it\'ll be as bad a second time or those who can\'t believe it\'s as bad as others made it out to be.\t\n\n\n\nYou\'re right; I watched it even expecting it to be carp!\n\nI was just relieved that Bernie didn\'t let his other mate Leepu loose on it (""Chop Shop"")'"
116240;'Rick';'Wed Apr 23, 2014 3:11 pm';"'The Fiat episode was crushingly dire, the ""arguments"" stretch credibility to well beyond breaking point. I don\'t know why I watch it really, I guess the subject still interests me even if the programme itself wants putting out of its (our) misery \n\n\n\nRJ'"
116241;'D4B';'Wed Apr 23, 2014 3:13 pm';'I might watch it again, but with the volume well and truly muted!!'
116272;'vitesse';'Thu Apr 24, 2014 12:28 am';"'Yeah ok the format is the same week after week, with the fake arguments etc... But the fact that some people watched it from start to end in this thread, sort of counter balances the negatives. \n\n\n\nI will continue to watch it and filter out what is rubbish but I still prefer to have some ""restoration"" programs on TV than none.\n\n\n\nAs far as I am concerned any old car that is restored is a job well done.'"
