87841;'47p2';'Fri Oct 12, 2012 9:21 pm';"'Just read this on another forum where someone wrote to Chanel 5 asking about the MGBGT...\n\n\n\n\n\n \t  Quote:\t\t\t  Update on the MBG being 2 or even 3 different cars, I sent channel 5 questions which I don\'t have a copy of but along the lines of confirming if indeed the car was the same as the wreck ""rescued "" from the barn and about the validity of the 2 week restoration claim. This was the reply I recieved:\n\n\n\n\n\n\n\nDear David \n\n\n\nThank you for your recent enquiry regarding Classic Car Rescue. \n\n\n\nWhile the production team were filming in Canada, the mechanics in London discovered some serious problems with the MGB, midway through the restoration, which meant they felt it might not be entirely safe to drive. Their original plan was to buy a new chassis, which is a common way that people restore MGBs (you can buy an entire new monocoque chassis for just \xc2\xa31000) and build on top of that. But wanting to stick with used parts, they bought another car and used the chassis from that, transferring much of the first MGB, right down to door-handles, and windows. The cost of the second car was included in the figures mentioned and the end result was a combination of the two. \n\n\n\nThe programme aims to show how Bernie Fineman and Mario Pacione cope with restoration jobs with a \xe2\x80\x9ctight deadline and an even tighter budget\xe2\x80\x9d in an entertaining fashion while also giving some background into why each selected model is held in the high regard that it is. It is not intended to, and does not claim to, demonstrate the detailed effort and finance that can go into the high end restoration of classic cars. \n\n\n\nNevertheless, this does not diminish the validity of your opinions and we are grateful to you for taking the time to make us aware of your concerns. Your comments have been logged in our Viewer Enquiries Report. This is circulated throughout the company and seen by all relevant personnel. \n\n\n\nThank you for your interest in Channel 5. \n\n\n\nYours sincerely \n\n\n\n\n\nIan \n\nVIEWER ADVISOR'"
87843;'Rick';'Fri Oct 12, 2012 10:31 pm';'Interesting stuff, I read elsewhere that there were certain differences between the car shown at the beginning, and the finished car. Who says the camera cannot tell fibs eh!? \n\n\n\nR'
87847;'scott_budds';'Fri Oct 12, 2012 11:53 pm';"""Saw my first one tonight the MGBGT one. It was giving me heart palpitations watching it! The rear wheels fell off when the car was lifted on the lift. How come the transition wasn't connected?  But then the welded new brackets back on but it the underside was that rusty what were they welding too!\n\n\n\nGood news you could win this car...Im that unlucky if I entered I would probably end up wining it! arghhhh\n\n\n\nI just cant watch programmes like this.\n\n\n\nBuddsy"""
87854;'Churchill Johnson';'Sat Oct 13, 2012 9:53 am';"""surely one cannot change a chassis from one car to another without using that car's registration number as this is what a reg is based on."""
87869;'MikeEdwards';'Sat Oct 13, 2012 5:58 pm';'Never mind that, since when did an MGB GT have a separate chassis? It has a monocoque bodyshell, and I am pretty sure a new Heritage shell is a little bit more than \xc2\xa31000.'
87876;'Rick';'Sat Oct 13, 2012 8:16 pm';"'MikeEdwards wrote:\t\t\t  Never mind that, since when did an MGB GT have a separate chassis? It has a monocoque bodyshell, and I am pretty sure a new Heritage shell is a little bit more than \xc2\xa31000.\t\n\n\n\n it justs get better the whole ""story"" doesn\'t it \n\n\n\nRJ'"
87878;'gresham flyer';'Sat Oct 13, 2012 9:33 pm';'If classic car programmes are not correct in detail and how to carry out a proper restoration,how many other types of TV programmes are incorrect.\n\nCookery,Financial,Gardening,Antique etc etc.\n\n Even radio 4 has its incorrect descriptions and detail when i have heard programmes about the motor car or the motorcycle,or another topic I am passionate about.\n\nI am sure these production companies can find better presenters.\n\n\n\nEven our old flower Ed China has a helping hand you know.....John Simpson from Practical Classics magazine was behind the scenes at last years NEC show.\n\nIf we cannot produce a proper programme about old cars here in the UK then it is a sad old world.\n\n\n\n                                     Gresham Flyer'
87886;'victor 101';'Sun Oct 14, 2012 8:10 am';"""I thought this guy Bernie was supposed to be a knowledgeable chap with 35 years in the trade, if his idea of checking a car for rust is jabbing a screwdriver in the inner wing or yanking a wing off so it hits the floor, its a wonder he hasn't had a smack in the mouth. Now that would make interesting viewing."""
87385;'Rick';'Mon Oct 01, 2012 5:47 pm';"""victor 101 wrote:\t\t\t  I started to watch it last week, but, like everyone here I thought it was rubbish, but I may watch it tonight for a different reason. Last week I thought I was going to watch a serious restoration program. This week I'm going to watch *spot the deliberate mistake* and see how many I can find.\t\n\n\n\nSame here, it may be drivel at times, but at least I'm interested in the subject, unlike Corrie and the related frothy dross usually on the box.\n\n\n\nR"""
87392;'scott_budds';'Mon Oct 01, 2012 8:14 pm';"""The amount and content of the posts here are mirrored on the lotus forum I am often found on. \n\n\n\nTwo points I would raise.\n\n\n\n1, Would anyone now buy any car from that used car dealer?\n\n\n\n2, Has anyone been onto a Jag forum to see what they think!!! \n\n\n\nI know its a Porsche next...but Tthere looks to be a Lotus Excel coming from the opening credits.\n\n\n\nTrouble is we along with so many other people are all talking about this pile of old....And I dare say having this hot cake on Channel 5's programming is a dream come true for them!\n\n\n\nBuddsy"""
87396;'pigtin';'Mon Oct 01, 2012 9:11 pm';"""OK I've just watched it. Only got halfway through last weeks, but this time I gritted my teeth and used the mute button liberally when the foul-mouthed cockney porker started shouting. I have now found what a distributor does, and cleaning the carbon off is all you have to do to fully service a Porsche engine.\n\nThe commercial breaks were a blessed relief, and at least, now, I can't be accused of criticising something I haven't watched all the way through.\n\n\n\nI shall not be watching it again. Er, is the porker related in any way to Greg Wallace?"""
87401;'welshrover';'Mon Oct 01, 2012 10:12 pm';'i liked the way he scraped the rotor arm with a something metal .i got my knuckles rapped when i worked in a garage by an old guy for doing the same thing .he said you dont rub anything metal on a rotor arm you use the sidewall of a tyre or something rubber as it takes metal off the rotor arm & alters the air gap in the distributer cap, dont f***in  do it again or youll get another he said,that was twenty odd years ago and i still use the side of a tyre to this day .'
87403;'D4B';'Mon Oct 01, 2012 10:29 pm';"""They couldn't stretch to a NEW cap and rotor?\n\nprobably the same reason they didn't change the oil.....\n\n\n\nI certainly don't want to win it anyhow"""
87409;'Rick';'Tue Oct 02, 2012 7:44 am';"""I don't understand why they left that cheapo front bumper/spoiler thing on it, when they could have probably bought a proper one from the spares place. The colour was awful (compared to the original).\n\n\n\nToo much shouty-shouty for me, why couldn't it have been presented more like Grand Designs, rather than something off a children's channel?\n\n\n\nR"""
87411;'riley541';'Tue Oct 02, 2012 7:56 am';"""The previous week's programme was utter rubbish, why watch more of it? I didn't."""
87417;'MikeEdwards';'Tue Oct 02, 2012 10:36 am';"'Well, I learned a few things. Apparently Scimitars and Land Rovers are rubbish, and Morris Minors are rare. And 1977 911s have an ECU, and as long as there isn\'t any welding in a specific part of the bodywork (assessed by feel rather than, I don\'t know, perhaps actually looking at it) it cannot possibly be a cut and shut.\n\n\n\nAnd all through the cut-and-shut section, the ""holier than thou"" attitude about how if it is, we\'ll have to scrap it straight away, made me laugh. If you had to imagine the kind of people that might sell a cut-and-shut, and the kind of premises they might work from, well, I don\'t need to spell it out, do I?\n\n\n\nI didn\'t think program was as bad as the first, some of the historic footage was quite good if a little brief and speeded up. Perhaps we should have a whip-round for a new catch for that workshop door that they take it in turns to slam, but doesn\'t close properly so it doesn\'t make a bang.'"
87420;'ukdave2002';'Tue Oct 02, 2012 11:04 am';"""D4B wrote:\t\t\t  They couldn't stretch to a NEW cap and rotor?\n\nprobably the same reason they didn't change the oil.....\n\n\n\nI certainly don't want to win it anyhow  \t\n\n\n\nDidn't watch it ....... I used to have a 911 of that era, they use a Capacitive Discharge ignition system, this requires all HT components to be in tip top condition otherwise misfires are common, HT leads, cap & rotor arm would be changed at least every 2 years, they weren't  expensive... cleaning the cap up is akin to putting tyre paint on a nearly bald tyre   \n\n\n\nDave"""
87443;'simes205';'Tue Oct 02, 2012 6:32 pm';'Shouty shouty shouty, although I managed to watch all of it this week rather than the week before.\n\n\n\nIt makes Wheeler dealers seem half decent.\n\n\n\nIt would be interesting to find out who wins the car!'
87448;'riley541';'Tue Oct 02, 2012 6:47 pm';'simes205 wrote:\t\t\t  \n\n\n\nIt would be interesting to find out who wins the car!\t\n\n\n\nIf it was you, would you admit to it?'
87450;'simes205';'Tue Oct 02, 2012 7:09 pm';'riley541 wrote:\t\t\t   \t  simes205 wrote:\t\t\t  \n\n\n\nIt would be interesting to find out who wins the car!\t\n\n\n\nIf it was you, would you admit to it?\t\n\n\n\nNo, I would be quite worried!'
87451;'Rick';'Tue Oct 02, 2012 7:12 pm';"""riley541 wrote:\t\t\t   \t  simes205 wrote:\t\t\t  \n\n\n\nIt would be interesting to find out who wins the car!\t\n\n\n\nIf it was you, would you admit to it?\t\n\n\n\nMaybe not admit to it, but I'd be very happy to win it, then sell it for whatever it achieved so that I could buy something better.\n\n\n\nR"""
87458;'BigJohn';'Tue Oct 02, 2012 8:37 pm';"""I Find that if I watch it as a comedy, a sort of The Muppet Show run a garage, it's very funny. BUT, If I regard it as any where near an informative motoring programme, I want to kick the T.V.\n\nYea! Go Fozzy Bear and Animal."""
87466;'Inglewood';'Tue Oct 02, 2012 9:15 pm';'I see that Bernie does not know the correct firing order, 1-5-3-6-2-4 is a typical straight-six but the Porsche flat six 3.3L is 1-6-2-4-3-5.'
87982;'peterwpg';'Tue Oct 16, 2012 4:55 pm';"'The Jag\' programme infiltrated our shores this week, courtesy of the Discovery Channel,  AKA  as ""Discover the bad acting Channel""\n\n\n\nSo I watched it and then penned this to them.\n\n\n\nHello\n\n \n\nI heard about this programme from my fellow vehicle restorers in the\n\n UK.    It is nothing more than a fictitious piece of twaddle.\n\n \n\nFake arguments,  ""staged""  accident,  and an even worse staged engine\n\n fault that produced exhaust smoke.\n\n \n\nIs  the discovery channel  producing a documentary  or a mediocre drama series ?\n\n \n\nThere were statements on the show that are 100% inaccurate, but they\n\n are so inaccurate that they had to be scripted because there are\n\n supposedly skilled tradespeople working on this vehicle  who would\n\n never utter such garbage.\n\n \n\nTry a little internet research of the show because this poor quality\n\n production is not bringing your business any good reviews. \n\n\n\nNo more to add.   I won\'t watch another'"
87983;'Rick';'Tue Oct 16, 2012 5:04 pm';"'Although staged like the rest of the programme, I find the opening 10 minutes or so, where the project cars are ""discovered"", to be moderately interesting. The rest I watch - sorry Riley541 - for amusement value only.\n\n\n\nRJ'"
87984;'ukdave2002';'Tue Oct 16, 2012 5:16 pm';"'Rick wrote:\t\t\t  Although staged like the rest of the programme, I find the opening 10 minutes or so, where the project cars are ""discovered"", to be moderately interesting. The rest I watch - sorry Riley541 - for amusement value only.\n\n\n\nRJ\t\n\n\n\nRick, Rick Rick...    ........\n\n\n\nOk I do admit to watching a clip online at work but only whilst on a really dull conference call... they stripped the bonnet with a chemical stripper and a da sander..on the basis of this alone I would watch the rest of the program...but I suspect in the rest of the program there will be less restoration and loads of staged drama!  \n\n\n\nDave'"
87985;'Rick';'Tue Oct 16, 2012 5:51 pm';"'ukdave2002 wrote:\t\t\t   \t  Rick wrote:\t\t\t  Although staged like the rest of the programme, I find the opening 10 minutes or so, where the project cars are ""discovered"", to be moderately interesting. The rest I watch - sorry Riley541 - for amusement value only.\n\n\n\nRJ\t\n\n\n\nRick, Rick Rick...    ........\n\n\n\nOk I do admit to watching a clip online at work but only whilst on a really dull conference call... they stripped the bonnet with a chemical stripper and a da sander..on the basis of this alone I would watch the rest of the program...but I suspect in the rest of the program there will be less restoration and loads of staged drama!  \n\n\n\nDave\t\n\n\n\nI guess I just like ""finds"", hence my passing interest in the first few minutes of each show. Please accept my most humble apologies \n\n\n\nRJ'"
88534;'Rick';'Mon Oct 29, 2012 5:20 pm';"""There's a Top Gear Bond 007 special tonight at 9pm on BBC2 (following on from CCR's attempts on C5 8pm to tart up a Mini).\n\n\n\nRJ"""
88536;'pigtin';'Mon Oct 29, 2012 5:45 pm';'Watched it, hated it, sent a complaint to C5 and erased it from my record list. An hour of my life wasted watching dumbed-down garbage.'
88538;'welshrover';'Mon Oct 29, 2012 6:17 pm';'there was a piece in classic car weekly about it last week, the mgb one.  about there bieng two cars doesnt look like ccw think much of it either.'
88649;'colwyn500';'Wed Oct 31, 2012 9:56 pm';"""I thought that this week's episode about a Mini was the least worst I have seen.  Oh no, I'm not starting to enjoy it am I...smash the telly!"""
88682;'welder';'Thu Nov 01, 2012 9:00 pm';"'colwyn500 wrote:\t\t\t  I thought that this week\'s episode about a Mini was the least worst I have seen.  Oh no, I\'m not starting to enjoy it am I...smash the telly!\t\n\n\n\nThat silly ""pretend"" fire made me laugh, especially when I noted that the guy was supposedly cutting the floor out. With a welding torch instead of a cutting nozzle.\n\n\n\nUtter tripe.\n\n\n\nIan'"
88684;'colwyn500';'Thu Nov 01, 2012 9:29 pm';"'welder wrote:\t\t\t   \t  colwyn500 wrote:\t\t\t  I thought that this week\'s episode about a Mini was the least worst I have seen.  Oh no, I\'m not starting to enjoy it am I...smash the telly!\t\n\n\n\nThat silly ""pretend"" fire made me laugh, especially when I noted that the guy was supposedly cutting the floor out. With a welding torch instead of a cutting nozzle.\n\n\n\nUtter tripe.\n\n\n\nIan\t\n\n\n\n...and then suddenly produced a plasma cutter; as if he wouldn\'t have picked that up first!'"
108845;'MikeEdwards';'Tue Oct 22, 2013 11:30 am';"""Hurrah! There's a second series of this coming next year."""
108849;'Rick';'Tue Oct 22, 2013 12:59 pm';"""MikeEdwards wrote:\t\t\t  Hurrah! There's a second series of this coming next year.\t\n\n\n\nI can hardly contain myself \n\n\n\nRJ"""
108858;'baconsdozen';'Tue Oct 22, 2013 5:20 pm';"""I watched one of these,it was about the bodging of an old E-type. The commentary was ludicrous,apparently the e-type was dangerous to drive because of its long wheel base!.\n\nTotal drivel. I turned off and haven't seen anymore. The producers could take the film crew round any car museum for a half hour and make a far more watchable program,and they wouldn't need that couple of clowns in the background either.\n\n\n\nEdit.....\n\nI've just realised how old this thread is and I've posted before,surely to God they are not repeating this tripe. It must be even worse second time around."""
115879;'MikeEdwards';'Mon Apr 14, 2014 12:58 pm';"'Tonight the new series starts off with them ruining a Porsche 928GT. Other vehicles to get the ""treatment"" in this series include a VW Camper, Ferrari Mondial, Corvette, and some others I\'ve forgotten now. Piece in the C5 advertiser, sorry Daily Express, today gives away the purchase price, cost to bodge and final valuations for all of them.'"
115885;'Rick';'Mon Apr 14, 2014 1:53 pm';"'MikeEdwards wrote:\t\t\t  Tonight the new series starts off with them ruining a Porsche 928GT. Other vehicles to get the ""treatment"" in this series include a VW Camper, Ferrari Mondial, Corvette, and some others I\'ve forgotten now. Piece in the C5 advertiser, sorry Daily Express, today gives away the purchase price, cost to bodge and final valuations for all of them.\t\n\n\n\nHopefully the producers have learnt from the mountain of flak they received after Series One, however I doubt it \n\n\n\nR'"
87476;'gresham flyer';'Tue Oct 02, 2012 11:28 pm';"'I think the best of all these programmes either produced in the UK or in the USA was ""OVERHAULIN"".\n\nChip Foose is a prolific car builder in his own right and a likable guy.\n\nThe presenters Chris Jacobs and Courtney Hansen (later replaced by CJ) were very good as well.\n\n\n\nThey added a bit of comedy into the format and who could not shed a tear when the car was exposed to the owner and all that american hugging went on (and that was just the guys).\n\nEven the rough tough car builders would all get emotional when hearing how pappa`s Chevy was now a memorial to his death.\n\n\n\nOk about 60 people were involved in the rebuild of these vehicles each time but they did it for real and the finished job was spot on...I would love to own one of these vehicles they must be priceless.\n\n\n\nI understand the programme is returning this week 2nd Oct.\n\n\n\nI also like watching Chasing Classic Cars with Wayne Carini,a really enthusiastic sort of guy when it came to old automobiles. My name is Wayne Carini and I like chasing cars (as long as its not women said Mrs Carini) at least there is no spanner throwing and trantrums like some other programmes.\n\n\n\nAs for Salvage Squad I liked Claire Barrett who went on to restore a watermill with her husband in real life,she was the sort of girl who liked to get DIRTY.!!!!\n\n\n\n                                          Gresham Flyer'"
87491;'pigtin';'Wed Oct 03, 2012 8:23 am';'Inglewood wrote:\t\t\t  I see that Bernie does not know the correct firing order, 1-5-3-6-2-4 is a typical straight-six but the Porsche flat six 3.3L is 1-6-2-4-3-5.\t\n\n\n\nAh! But is this also the case with the 1977 3.3 fitted with an ECU?'
87496;'MikeEdwards';'Wed Oct 03, 2012 10:34 am';'Ooh, I withdraw my comments about ECUs. Looking at the original build thread: http://www.myporsche911.co.uk/upb/viewtopic.php?id=14&t_id=25&page=1 it seems it had a 3.2 transplant which has some kind of engine management system. Then it got painted with aerosols, which might be a clue about the blemishes on the roof.'
87505;'ukdave2002';'Wed Oct 03, 2012 5:19 pm';"'MikeEdwards wrote:\t\t\t  Ooh, I withdraw my comments about ECUs. Looking at the original build thread: http://www.myporsche911.co.uk/upb/viewtopic.php?id=14&t_id=25&page=1 it seems it had a 3.2 transplant which has some kind of engine management system. Then it got painted with aerosols, which might be a clue about the blemishes on the roof.\t\n\n\n\nIt would have had a 2.7l engine originally with the Boch K-tronic (electro-mechanical) fuel injection, the later 3.0l had the k-tronic until about 82/3 when the 3.2l engine was introduced,that I believe had an ECU.\n\n\n\nI thought the program was marginally better than the previous week, would have been better if the staged arguments had been cut, and the time spent on the repairs! at least this show did illustrate some techniques like the guide coat for picking up minor body defects.\n\n\n\nWhat I thought was interesting was the type of adverts during the breaks (assuming the online version has the same as the TV) which were for women s cloths, chocolate bars and breakfast cereal; not the sort of adverts one would expect for the average restorer ?  possibly this gives a clue to the target audience?\n\n\n\nDave'"
87581;'Ellis';'Fri Oct 05, 2012 10:36 pm';'simes205 wrote:\t\t\t  \n\n\n\nIt makes Wheeler dealers seem half decent.\n\n\n\n\t\n\n\n\nI agree, but even Wheeler Dealers, staged and cliched as it is, shows you how to do things properly although the Mark 2 Jaguar programme last week was not one of their best.\n\n\n\nI used to enjoy American Hotrod with Boyd Coddington and company. I disagreed and cringed with what they did to original cars but I was fascinated with the restoration techniques they used. And, by heaven, they were thorough.'
87627;'Rick';'Sun Oct 07, 2012 10:04 am';'I wonder if the same discerning team were behind this conversion of an old Silver Spirit, into a shiny new (slightly ripply) Phantom   \n\n\n\nhttp://www.ebay.co.uk/itm/1990-ROLLS-ROYCE-WHITE-PHANTOM-REPLICA-/110961236870\n\n\n\nRJ'
87671;'baconsdozen';'Mon Oct 08, 2012 11:31 am';"""The porsche 'restoration' reminded me of some of the Red Green episodes.\n\nOnly one is an intentional comedy but both are amusing."""
87675;'Rick';'Mon Oct 08, 2012 12:50 pm';"'An old MGB gets the ""treatment"" tonight, and following it on BBC4 is a programme about Brit sportscars following WW2 (not sure if it\'s a repeat or not?), and a repeat of the programme about Ford in Dagenham.\n\n\n\nRJ'"
87676;'riley541';'Mon Oct 08, 2012 1:04 pm';"'Rick wrote:\t\t\t  An old MGB gets the ""treatment"" tonight, and following it on BBC4 is a programme about Brit sportscars following WW2 (not sure if it\'s a repeat or not?), and a repeat of the programme about Ford in Dagenham.\n\n\n\nRJ\t\n\n\n\nI shall be watching two of the three!'"
87677;'Roger-hatchy';'Mon Oct 08, 2012 1:07 pm';'Not watched it so far.\n\n\n\nA question: are the cars wrecks before the program, or after the program?\n\n\n\nRoger'
87686;'welshrover';'Mon Oct 08, 2012 5:46 pm';'Rick wrote:\t\t\t  I wonder if the same discerning team were behind this conversion of an old Silver Spirit, into a shiny new (slightly ripply) Phantom   \n\n\n\nhttp://www.ebay.co.uk/itm/1990-ROLLS-ROYCE-WHITE-PHANTOM-REPLICA-/110961236870\n\n\n\nRJ\t\n\ngod that is awful'
87718;'Rick';'Tue Oct 09, 2012 12:29 pm';"""Well the MGB is green and shiny now judging by last night's programme, converted from rubber to chrome bumpers, with the former type's high-set suspension remaining    \n\n\n\nThe shed that the rusty B was bought from looked very interesting, best bit of the programme really.\n\n\n\nThe BBC4 programme by contrast was very watchable I thought.\n\n\n\nRJ"""
87722;'Brian M';'Tue Oct 09, 2012 1:53 pm';'I still have not managed to watch a whole episode of Classic Rescue for fear of putting something through the tv in frustration.  Last night got as far as the pantomime when they put the car on a two post lift and were surprised that the rotten outriggers collapsed.\n\n\n\nIn contrast the programme on the British Sportscars was a delight.  Spoilt only by the use of pre-war factory shots that were meant to represent the production of the cars being discussed!'
87741;'welshrover';'Tue Oct 09, 2012 6:04 pm';'the cut springs would help the axle to fall out. there was no spring eyes on either end of the springs'
87744;'pigtin';'Tue Oct 09, 2012 6:33 pm';"""I've already taken it off the 'record' list and don't intend to watch any more. Watching it would only encourage them and this sort of thing can have a detrimental effect on one's IQ."""
115919;'Rick';'Tue Apr 15, 2014 7:12 am';"""So did anyone here watch it? IMO it was ok to have on in the background while I was reading, but it wasn't exactly un-missable TV which - in theory - a series like this should be \n\n\n\nRJ"""
115925;'baconsdozen';'Tue Apr 15, 2014 8:28 am';"""I didn't bother. On the last program I saw involving a classic car on this channel, they invited Frankie Fraser round for his 'expert' comments about a gangster car. Bug eyed Bernie was (according to him) also somehow involved on the fringes of Londons underworld and hinted at 'dark secrets' Dream on baby.\n\nThe programs are an insult to peoples intelligence. Total,complete and utter unmitigated drivel.\n\nFor people who know what they're doing you can't beat people like Tommy Walsh or Ed China,for engaging his audience and combining entertainment with presenting Fred Dibnah took some beating too."""
115929;'D4B';'Tue Apr 15, 2014 9:01 am';'baconsdozen wrote:\t\t\t  for engaging his audience and combining entertainment with presenting Fred Dibnah took some beating too.\t\n\n\n\nAgreed ~ fantastic'
115933;'kevin2306';'Tue Apr 15, 2014 9:42 am';"""Fred was so enthusiastic, met him socially a few times through a vintage show i was involved with, he also knew how to charge for personal appearences   \n\nI really avoid and program that bernie is on and only watch ed's lot until the final scenes when the 'buyer' turns up to do the deal.\n\n\n\nKev"""
